{
  "schema_version": "live-review-policy-v1",
  "policy_name": "example-local-live-dry-run-policy",
  "reviewer": "REPLACE_WITH_REVIEWER_NAME",
  "approved_for_live_network": false,
  "allowed_surveys": [
    "ZTF",
    "ATLAS",
    "PanSTARRS"
  ],
  "max_queries_per_run": 3,
  "min_seconds_between_queries": 10,
  "dry_run_scope": {
    "ra_deg": 180.0,
    "dec_deg": 0.0,
    "radius_deg": 0.1,
    "start_jd": 2460000.5,
    "end_jd": 2460001.5
  },
  "no_external_submission_confirmed": true,
  "no_impact_probability_claims": true,
  "notes": "Example policy only. Leave approved_for_live_network=false until a human reviewer approves a real credentialed dry run."
}
